,statis_id,content
144,13652355666_10154026495340667,"See live results by tapping the map for a full view, and get USA TODAY’s full coverage here: elections.usatoday.com"
999,13652355666_10153666066965667,"Ginsberg didn't hold back, and Trump isn't happy about it."
641,13652355666_10153880146450667,The original Trump came home.
1602,13652355666_10153090248230667,Russia-linked hackers tried at least five times to pry into Hillary Clinton's private email account while she was secretary of State. It's unclear if any of the attempts worked.
1309,13652355666_10153373810080667,"Hillary Clinton and Bernie Sanders stretched the facts on immigration, and the environment."
768,13652355666_10153780361405667,"""Oh, and note to Trump, the African-American community is not “under Democratic control,” says Donna Brazile."
1069,13652355666_10153599659575667,"BREAKING: Hillary Clinton calls on Americans to stand united in the face of the threat posed by the Islamic State, saying ""now we have to steel our resolve to respond."""
43,13652355666_10154038066720667,Opponents of President-elect Donald Trump crowded into the streets across the country Friday for a third day and night of protests following Hillary Clinton's surprise loss in the White House race.
688,13652355666_10153848953780667,"Jimmy Fallon told Donald J. Trump he'd be ""gentle,"" but some viewers thought he was too gentle. "
1723,13652355666_10152871995475667,"Walter Scheib, a former executive chef to Bill Clinton and George W. Bush, had been missing for more than a week."
969,13652355666_10153681290970667,Pro-Trump delegates tried to shout down the insurgents.
98,13652355666_10154029915455667,Hillary Clinton gave her concession speech the morning after Election Day. We took a look at how the timeline between one candidate reaching 270 and the other candidate conceding compares in the last three elections. 
1349,13652355666_10153356138495667,"""Is it possible that your quarrel is not so much with Donald Trump as it is with Republican primary voters?"""
1304,13652355666_10153378700380667,Clinton's remarks were met with widespread criticism because the Reagans little about HIV and AIDS when the disease was ravaging the gay community in America.
599,13652355666_10153902306130667,"John Podesta, Hillary Clinton's campaign manager talks to us from Longwood University."
1656,13652355666_10153009149355667,"Today in 1992, President George H. W. Bush accepted the Republican nomination in a presidential campaign featuring a Bush, a Clinton and a billionaire -- sound familiar? See how much you know about that election: (Photo by Steve Helber, AP)"
901,13652355666_1669517840039404,Eva Longoria slammed Trump's comments at the Democratic National Convention.
806,13652355666_10153743869875667,Donald Trump has a Florida lawsuit problem.
1143,13652355666_10153536968305667,It’s hard to imagine Paul Ryan endorsing Donald Trump.But it’s even harder to imagine him not doing it.
1214,13652355666_10153485299595667,"In order to take all 95 of New York's delegates, Trump would have to win more than 50% of the the votes statewide, and more than 50% in each of New York's 27 congressional districts. Early returns were inconclusive."
1489,13652355666_10153238947885667,"As 2015 ends, Donald Trump remains firmly entrenched atop USA TODAY's GOP Power Rankings. But that could change as the Feb. 1 Iowa caucuses approach.  ""It's about to get real,"" said political analyst Nathan Gonzales. "
891,13652355666_10153701001980667,Hillary Clinton just became the first female presidential nominee of a major party. Here's the reaction on the floor.
290,13652355666_10153988576150667,Bill Clinton officiated her marriage to Anthony Weiner.
1574,13652355666_10153122516975667,"""I took responsibility,"" Hillary Clinton tells the House committee on Benghazi. "
256,13652355666_1735490076775513,"The Brits can't vote in the U.S. election, but they can make giant stautes of presidential candidates... and burn them to the ground."
23,13652355666_10154047571835667,"BREAKING: Gwen Ifill of PBS NewsHour has died at 61, according to several reports.  had been absent from PBS's election coverage last week due to ongoing health issues. She was moderator and managing editor of Washington Week and co-anchor and managing editor of the PBS NewsHour. Her death was reported by Politico and The Washington Post."
204,13652355666_10154017322705667,"""I want to be president for all Americans — Democrats, Republicans and independents; Americans of every race, faith and background,"" Hillary Clinton writes."
1005,13652355666_10153662157170667,Could this be the end for the Democratic presidential race between Hillary Clinton and Bernie Sanders?
1112,13652355666_10153564114990667,A federal judge is ordering the release of Trump University internal documents in a class-action lawsuit against the now-defunct real estate school owned by presumptive Republican presidential nominee Donald Trump.
606,13652355666_10153899149990667,BREAKING: The New York attorney general's office has ordered the Donald J. Trump Foundation to stop soliciting any contributions following an investigation into the charity.
730,13652355666_10153830755175667,"""If Donald J. Trump wins, the country will fall backward and become more isolated from the global community."""
1660,13652355666_10153007173755667,Happy birthday to Bill Clinton! 
136,13652355666_10154026582310667,Celebrities came out in full force behind Hillary Clinton in the 2016 race.
1498,13652355666_10153222212345667,"""Yes, sure, there are allegations. I've read those allegations over the years, but nobody's proven that he's killed anybody as far as I'm concerned,"" Trump said."
681,13652355666_10153852360155667,Donald J. Trump is under fire for comments about Hillary Clinton that seem to invite violence against her: 
597,13652355666_1713934482264406,The zingers are flying tonight. Here's Tim Kaine calling Mike Pence Donald Trump's apprentice. 
812,13652355666_10153740167380667,Not the first time it's happened this election cycle.
947,13652355666_10153685720720667,"""On all of these counts, Trump is the anti-Bush candidate,"""
1195,13652355666_10153498996385667,"Hillary Clinton has won the Connecticut Democratic primary, giving her victories in four of five contests Tuesday. "
446,13652355666_10153942690045667,It was the Republican's largest monthly haul of the election but far short of $154 million Democrat Hillary Clinton and her allies raised last month.
1056,13652355666_10153620100405667,Donald J. Trump is trying to get back on track with a familiar tactic.
1528,13652355666_10153189379645667,"Meanwhile, among Democrats, Hillary bested Bernie 60% to 30% in the latest Quinnipiac University National Poll."
1387,13652355666_10153336172015667,Donald Trump has won the South Carolina Republican primary — his second primary victory. The GOP front-runner won the New Hampshire primary earlier this month after losing to Ted Cruz in Iowa. Republicans next face off in the Nevada caucuses on Tuesday.
55,13652355666_10154036168210667,Stephen Colbert joked Obama and Trump’s meeting was “The most surprising remake of Guess Who’s Coming to Dinner.”
215,13652355666_10154015143740667,"“We had 17. We have one left,” Trump said, referring to primary contenders. “I have one left before we make this country great again.”"
1321,13652355666_10153369960735667,"Another win for Donald Trump. He takes the Michigan GOP primary, NBC and Fox project. "
359,13652355666_10153967236665667,With a smile on her face — and some help from a poll worker — the far-off fantasy of electing a woman for president came closer to reality as she voted for Democratic nominee Hillary Clinton.
709,13652355666_10153842321930667,"""It's pro-family, it's pro-child, it's pro-worker,"" Trump told a supportive crowd in Aston, Pa., near Philadelphia."
1667,13652355666_10152994080650667,"Like it or not, Donald J. Trump is leading in Iowa."
697,13652355666_10153844989805667,The Clinton campaign hopes to squash the narrative of Hillary's broader health concerns with the release of additional medical records. 
619,13652355666_10153892508155667,Donald J. Trump walked right into Hillary Clinton’s trap.
1235,13652355666_10153461890725667,Obama has some advice for Democrats who worry about the White House prospects of Donald Trump: Don't.
1572,13652355666_10153122322730667,"""Even some of the people who are on the stage with me"" are terrific, says Donald J. Trump. "
1739,13652355666_10152783543445667,Looks like those who want a look at Hillary Clinton's emails have a long wait ahead of them.
292,13652355666_10153987891575667,Sen. Bernie Sanders is laying the groundwork for his post-election activism.
662,13652355666_10153869599985667,BREAKING: Ted Cruz will vote for Donald J. Trump.
14,13652355666_10154046534080667,"Trump's victory over Clinton — an outcome few in the tech industry supported, and many failed to believe would happen — has engendered a mix of shock, anger, grief and denial in Silicon Valley."
1583,13652355666_10153119545760667,"A month ago, political analysts were predicting the demise of Donald J. Trump. Now, they've ranked him No. 1 again."
519,13652355666_10153920725120667,"""As a black, gay Millennial, I’m ready for this election to be over.""More in USA TODAY Opinion:"
1348,13652355666_10153356258720667,Gov. Chris Christie got a lot of attention for his lack of attention during Donald Trump's speech on Super Tuesday. 
282,13652355666_10153992363870667,Trump has some new ammunition.
71,13652355666_10154032631050667,The 2016 elections became the latest in a string of volatile federal elections to challenge long-standing notions about the role of money in politics.
1107,13652355666_10153571444880667,Litigator in chief? Susan Page on the new USA TODAY analysis of Donald Trump and the courts
65,13652355666_10154033935185667,"President Obama and his soon-to-be successor, Donald Trump, had never met — until Thursday."
1118,13652355666_10153558310595667,It's been a rather rocky road through the Southwest for Trump.
327,13652355666_10153978211160667,USA TODAY looked back at how Hillary Clinton has spent some of her other birthdays and what was going on in Clinton’s life every decade.
1594,13652355666_10153108479210667,"The last time Donald J. Trump hosted Saturday Night Live was April 2004 when ""The Apprentice"" was blowing up and everyone was firing each other in daily conversation."
129,13652355666_10154026839985667,"""Wouldn't wanna be under that giant glass ceiling if Hillary is forced to concede."""
29,13652355666_10154045802175667,He offered to buy bus fare to Canada for student protesters of President-elect Donald Trump if they promised not to return.
2,13652355666_10154051486850667,"""I do feel a responsibility as president of the United States to make sure that I facilitate a good transition,"" President Obama said about Donald Trump."
1324,13652355666_10153369891105667,"Hillary Clinton wins the Mississippi Democratic primary, the first of six contests in four states tonight. "
1453,13652355666_10153286698710667,Indiana is known for its strict alcohol laws. Sunday brings aisles of booze roped off and closed signs on liquor store doors. Alcohol sales were not permitted on Election Day until 2010.
976,13652355666_10153669789795667,Doonesbury has been preparing us for President Donald J. Trump since 1987. via USA TODAY Opinion
12,13652355666_10154050147435667,"""One of the more amusing bits of fallout from last week’s election has been the safe-space response of many colleges and universities to the election of the 'wrong' candidate.""More in USA TODAY Opinion:"
80,13652355666_10154031663195667,"For those looking for an exit following Donald J. Trump's election win, you may find additional business visas if you speak a second language."
1319,13652355666_10153370107950667,All the major networks stayed glued to Donald Trump as he gave a rambling victory speech. Not one tuned into Hillary Clinton's speech.
470,13652355666_10153932123850667,"Just before Clinton and Trump squared off in what would become one of the nastiest debates in history, Clinton posted a photo of herself in a white coat with the caption saying “Let’s go. #Debate.” The post has 276,000 likes."
171,13652355666_10154024239245667,If you need an election escape.
498,13652355666_10153924837530667,"If Hillary Clinton wins and the Democrats take the House and the Senate, it would mean she could push her agenda of higher taxes on wealthy Americans, more regulation of banks, a focus on clean energy and less onerous drug pricing."
