,statis_id,content
2273,8304333127_10153804117498128,“This outcome eliminates concerns regarding formation of the government or repeat elections.”
1754,8304333127_10154202127368128,"If Democratic superdelegates were assigned by state winner, Bernie Sanders would gain on Hillary Clinton, but still trail."
1002,8304333127_10154551843338128,Melania Trump dismissed any suggestion that she may have lived or worked illegally in the U.S.
961,8304333127_10154574092328128,Many parts of the U.S. are still suffering from the aftershocks of Chinese imports. Donald Trump has tapped into potent anti-free-trade sentiment on the campaign trail.
1722,8304333127_10154220053773128,"Seeking to press her case to Latino voters, Democratic presidential front-runner Hillary Clinton said she would create a national Office of Immigrant Affairs that would coordinate government policy on the issue if she reaches the White House."
1651,8304333127_10154254218818128,What questions do you have about the 2016 election? Ask Reid Epstein and Laura Meckler now.
2143,8304333127_10153961541668128,"Three opposition lawmakers gave up their seats in the National Assembly, stripping President Nicolás Maduro’s adversaries of the supermajority they had won in December’s legislative elections."
1855,8304333127_10154117111953128,"The Republican National Committee is escalating its legal battle against the State Department, filing four more lawsuits for records related to Hillary Clinton’s time in office."
1880,8304333127_10154092754408128,RNC officials also are expected to file a second case seeking access to all text and BlackBerry messages sent and received by Hillary Clinton during her time at the State Department.
1688,8304333127_10154235637433128,"New York City Mayor Bill de Blasio said he asked the Board of Elections to investigate why about 60,000 voters were dropped from the rolls in Brooklyn."
1424,8304333127_10154350356193128,Also included in the batch of documents just made public: a “sales playbook” from 2007 that offered tips to Trump University salesmen on how to “close a client.”
2444,8304333127_10153567631923128,"A series of bootleg recordings, fuzzy amateur video and speech excerpts lift the lid on what Hillary Clinton has said at private events."
2436,8304333127_10153576385253128,"Hillary Clinton offered a preview of her plans to combat climate change, but stayed silent on the question of whether the Keystone XL pipeline should be built, declining to weigh in on what has been a contentious yearslong debate."
1856,8304333127_10154115233013128,"Sen. Bernie Sanders continued to attack rival Hillary Clinton ahead of a critical day of balloting, while Mrs. Clinton suggested voters on Tuesday could deliver a knockout blow that would allow her to pivot toward the general election."
1000,8304333127_10154552624413128,"""I've never heard of somebody complaining about being cheated before the game was over,"" said President Obama on Donald Trump's claim that the November presidential election would be rigged."
2316,8304333127_10153754104988128,While the New York Yankees have a following of rich and powerful fans (think: Donald Trump or LeBron James)  New York Mets' celebrity fans are known for something the franchise itself has long since mastered: making people laugh at them.
1830,8304333127_10154127359858128,A judge could rule as soon as April on Trump University fraud allegations
133,8304333127_10154912883188128,"Trump’s presidential election victory has increased the chances that President Barack Obama’s landmark net-neutrality rules could be rolled back, some telecom investors and experts said Wednesday."
9,8304333127_10154945050053128,"Donald Trump praised the U.S. electoral college system that delivered him victory in the presidential race despite winning fewer votes than his rival Hillary Clinton, arguing it broadens the playing field to include small states."
2238,8304333127_10153839166978128,The move to take down Trump comes as a growing number of Republicans fear damage to party’s image and ‘Hillary Clinton will become president’
825,8304333127_10154663114143128,"A new CNN/ORC national poll shows Republican Donald Trump leading Democrat Hillary Clinton by a narrow two points, the first time the businessman has had the top spot in this poll in several months."
147,8304333127_10154911783518128,"House Speaker Paul Ryan struck a positive tone toward President-elect Donald J. Trump, saying a united Republican Party will stand together after Mr. Trump’s stunning election victory."
1504,8304333127_10154310534278128,"Hillary Clinton created a stir when she deviated from her typically vague description of the role her husband, former President Bill Clinton, would play if she is elected president."
1912,8304333127_10154082692708128,"Billionaires Carl Icahn and Andrew Beal were battling with Donald J. Trump in bankruptcy court a decade ago. Now, they're backing him as an outsider who could help shake up politics."
183,8304333127_10154908974243128,"White working-class voters helped Donald J. Trump overcome Hillary Clinton’s strong support from minority voters and white, educated women."
2224,8304333127_10153860765783128,Garry McCarthy’s departure comes a week after the police department released a graphic dashboard video of Laquan McDonald’s death.
946,8304333127_10154587108598128,"Hillary Clinton seeks to placate her own party’s liberals, to pull back some of those traditionally Democratic white working-class males tempted to defect to Mr. Trump, and to woo moderate Republicans now willing to jump ship."
2145,8304333127_10153959725593128,"Voters in Taiwan, the only democracy in the Chinese-speaking world, will choose a new president and legislature Saturday. Here are five things to watch for in the elections."
1413,8304333127_10154354005763128,"House Speaker Paul Ryan endorsed Donald J. Trump for president, ending the highest-ranking Republican elected official’s public hesitation over the GOP’s presumptive presidential nominee."
264,8304333127_10154891216788128,"Andrew Roberts writes in WSJ Opinion: ""The only rational response to the choice of Hillary Clinton or Donald J. Trump is that of Henry Kissinger on the Iran-Iraq War: 'A pity they both can’t lose.' """
1072,8304333127_10154528376563128,The importance of Hillary Clinton's Thursday night speech wrapping up the Democratic presidential convention can't be overstated.
1755,8304333127_10154200522743128,"With chances of a contested convention increasing after Texas Sen. Ted Cruz’s win over Donald Trump in Wisconsin’s primary, the campaigns are fighting for each individual delegate in every state."
2352,8304333127_10153702698293128,"The election of the far-left Mr. Corbyn would appear to turn political logic on its head, writes Simon Nixon."
458,8304333127_10154806232848128,"For the third time, only Republican Donald Trump and Democrat Hillary Clinton will face off. Not on stage: Libertarian Gary Johnson and Green Party nominee Jill Stein."
293,8304333127_10154882043723128,Hillary Clinton has turned to such allies as President Obama and hip-hop artist Jay Z to nudge African-Americans to the polls in Ohio and other presidential battlegrounds.
1506,8304333127_10154310063623128,"Presumptive Republican presidential nominee Donald J. Trump is deeply unpopular among female voters, a group that could help decide the 2016 election. WSJ's Shelby Holliday explains why the GOP needs to improve its numbers among women."
1554,8304333127_10154291878188128,"Hillary Clinton trails Donald J. Trump in the perennial battleground state of Ohio and clings to one-point leads in Florida and Pennsylvania, according to a new poll."
1056,8304333127_10154530795028128,"Hedge funds pour money into U.S. presidential campaign; Clinton is biggest beneficiary, by far."
1629,8304333127_10154262864588128,"Trump avoided the scene: His motorcade of dark SUVs pulled to the side of the road, and Trump and an entourage of men wearing dark suits and ties walked across a median strip of grass to enter the hotel through a back entrance."
1367,8304333127_10154372041503128,"""Right-of-center populists in continental Europe, advocates for a British exit from the European Union, and Donald Trump, the presumptive Republican nominee for U.S. president, derive their backing less from a broad backlash against globalization than from one specific facet of it: immigration, which arouses anxieties that are racial and cultural, not just economic."""
1737,8304333127_10154211835593128,Both of the Clintons have been on the defensive over tough-on-crime policies enacted when President Bill Clinton was in the White House.
1190,8304333127_10154485551613128,"The populist insurgency of William Jennings Bryan is a cautionary fable about the rise of Trump, says David Frum."
1752,8304333127_10154202849548128,"After Hillary Clinton said Bernie Sanders's recent comments about big banks raised questions about his readiness for the White House, he responded by saying it was Clinton who was unqualified for the top job."
2429,8304333127_10153586394503128,Bundlers known as Hillblazers increased their giving as the Clinton Foundation pushed to fund $250 million endowment.
425,8304333127_10154814530628128,Live with Tanya Rivero:  Takeaways from Wednesday's debate between Donald J. Trump and Hillary Clinton. Wine from an Italian prison. How to best care for your houseplants in winter.
1653,8304333127_10154253428948128,The five Eastern states voting in Tuesday's primaries are expected to yield more victories for Donald J. Trump and Hillary Clinton. WSJ's Gerald F. Seib explains what wins by the front-runners could mean for the Democratic and GOP races.
2267,8304333127_10153807879368128,"McDonald's is pushing upscale in the U.K., offering a new “premium” burger made entirely from British and Irish beef and served in black packaging."
2294,8304333127_10153776245988128,"Donald Trump, the party’s 2016 frontrunner, has in recent days repeatedly jabbed Jeb Bush and his brother, former President George W. Bush, over the latter’s handling of the 2001 terrorist attacks."
1936,8304333127_10154075986258128,Wealthy donors who have so far stayed on the sidelines or hedged their bets by donating to multiple candidates may soon need to decide whether to back Donald Trump or sit out the election altogether.
2450,8304333127_10153561104483128,"Today's top stories: Gerard Baker on the U.S. housing market, Hillary Clinton's tax proposal and more."
2125,8304333127_10153975253158128,"Sarah Palin’s endorsement will boost Donald Trump’s conservative credentials as he battles with Texas Sen. Ted Cruz for a win in Iowa, where the two Republicans are neck-and-neck in the polls."
1527,8304333127_10154299883633128,Some Republicans are expressing concern about Donald Trump's possible effect on congressional races.
1221,8304333127_10154468695963128,"Retired Army Lt. Gen. Michael Flynn, a possible vice presidential pick by Donald J. Trump, came out in favor of abortion rights, putting him sharply at odds with the majority of Republicans."
2250,8304333127_10153820609258128,"Trump summed up Tuesday night's Republican presidential debate, and explains why he stands by his border-wall proposal."
1786,8304333127_10154178011793128,Hillary Clinton has been showcasing her ties to African-Americans over the past few days in Wisconsin.
2433,8304333127_10153579473253128,"For one night, McDonald’s pulled out the fine china in Tokyo. Diners sampled a five-course meal made of ingredients for burgers and French fries.Watch full video: "
644,8304333127_10154748071518128,A new report showing Donald Trump recorded a $916 million loss on his 1995 tax return will focus more attention on his business practices and his refusal to release any recent federal tax filings.
1092,8304333127_10154523322378128,"Hillary Clinton is officially the first female presidential nominee of a major party, but women who witnessed the milestone at the Democratic National Convention have different opinions on the historic moment."
2315,8304333127_10153754517233128,"Investigators believe the attempted hacks on Clinton's email server originated in China, South Korea and Germany."
1438,8304333127_10154340896003128,Can nominees polish up a negative image? Sometimes. Both Bill Clinton in 1992 and Barack Obama in 2008 benefited from a change in perception.
1001,8304333127_10154552274673128,"Donald J. Trump has lost ground with voters amid a series of missteps following the party conventions, with a new national poll showing Hillary Clinton opening a 9-point lead over the New York businessman."
122,8304333127_10154914194003128,Several Wall Street financiers and other successful business leaders could be in line to run top posts in Donald J. Trump's presidential administration.
674,8304333127_10154733302443128,"Hillary Clinton attacked Donald J. Trump for not releasing his tax returns, saying it may be because he hasn't paid federal taxes."
1853,8304333127_10154117782143128,"Florida and Ohio will allot 165 Republican delegates, a bounty that could give front-runner Donald J. Trump an insurmountable lead."
207,8304333127_10154906969423128,It's Election Day and the polls close in just a few hours. What questions do you have for WSJ political reporters about the presidential and Senate races? Post in the comments below.
2142,8304333127_10153961567463128,"As polls show Mr. Sanders ahead in New Hampshire and closing the gap in Iowa, Mrs. Clinton, her daughter and top campaign aides have unleashed a string of attacks on the Vermont senator’s policy agenda."
1294,8304333127_10154426472348128,Conservative commentator and journalist George Will said he is leaving the Republican Party over its impending nomination of Donald Trump as the party's presidential standard-bearer.
2298,8304333127_10153770743978128,"Donald J. Trump spent $678,000 on items listed as hats or “t-shirts/hats.”"
1462,8304333127_10154332223213128,Front-runners Hillary Clinton and Donald Trump are among the least liked candidates in American history. What would it take for them to turn it around?
2370,8304333127_10153670643273128,A new Jeb Bush video attacks Donald Trump for his past praise of Hillary Clinton.
1353,8304333127_10154375502283128,Donald J. Trump is pursuing a financial strategy that would leave him largely reliant on party spending that he won’t be able to fully control.
1163,8304333127_10154499619913128,"Labor Secretary Tom Perez, in the running to be Hillary Clinton’s running mate, regularly says his grandfather was expelled from the Dominican Republic for opposing the dictatorship of Rafael Trujillo. Archival records offer a more complicated picture."
722,8304333127_10154713814873128,"Gary Johnson and Jill Stein have shown remarkably durable support in polls, complicating the electoral math for the two major party candidates."
2503,8304333127_10153399125633128,"Now on Wall Street Journal: all of the available Hillary Clinton emails.  Help us pore through the documents, tag and analyze them with our interactive reader."
1630,8304333127_10154262472498128,What will Berkshire look like after you’re gone? And what do you think of Donald Trump?
311,8304333127_10154872491043128,Former Miss Universe Alicia Machado introduced Hillary Clinton Tuesday in the key swing state of Florida.
962,8304333127_10154573294793128,Hillary Clinton is set to dial up a line of attack on Donald Trump’s economic proposal.
669,8304333127_10154735023303128,"Six weeks before Election Day, Trump lets a personal feud become a campaign issue."
280,8304333127_10154887060498128,"Youngstown, Pennsylvania is home to the ""Trump House,"" complete with 14-foot tall metal cutout of Donald J. Trump."
1209,8304333127_10154474054388128,"Senator Bernie Sanders is finally coming on board Hillary Clinton’s campaign, asserting “she will be the Democratic nominee.” What did Sanders’ insurgency tell America about itself? WSJ’s Jason Bellini reports."
256,8304333127_10154895449578128,The latest Wall Street Journal/NBC poll finds 44% of likely voters support Hillary Clinton compared with 40% support for Donald Trump.
33,8304333127_10154939347188128,"Donald Trump’s election has turned markets topsy-turvy, a boon for Wall Street and day traders alike who can profit from the increased trading volume."
957,8304333127_10154577325038128,"Hillary Clinton and her husband, former President Bill Clinton, paid an effective federal income tax rate of 34% in 2015 and donated nearly 10% of their gross income to charity, the campaign said in a statement."
159,8304333127_10154911107163128,"Donald Trump’s ‘deplorables’ rise up to reshape America, delivering an election victory to the Republican nominee, writes Gerald F. Seib."
2271,8304333127_10153805433833128,"The company behind the Keystone XL pipeline asked to suspend its U.S. permit application, throwing the politically fraught project into an indefinite state of limbo, beyond the 2016 U.S. elections."
1248,8304333127_10154454627593128,"The 10-Point: Gerard Baker on Hillary Clinton’s emails, Brexit turbulence, oil industry spending and more"
922,8304333127_10154602035143128,"A federal judge ordered Hillary Clinton to submit written testimony to questions from a conservative legal group in response to a lawsuit over email records. ""This is just another lawsuit intended to try to hurt Hillary Clinton’s campaign,” Clinton campaign spokesman Brian Fallon said Friday after the judge’s ruling."
89,8304333127_10154918020803128,"Educators are bracing for a big boost to school choice programs under President-elect Donald Trump, but he has been silent on some other big topics affecting the nation’s public students."
1238,8304333127_10154457187693128,"The 10-Point: Gerard Baker on today's top news, including looming convention challenges for Hillary Clinton and Donald J. Trump, self-driving technology under increased scrutiny and more."
2362,8304333127_10153686412233128,"Aung San Suu Kyi won't become president, and four other things to know about Myanmar's election."
1645,8304333127_10154255240313128,"""There's much more that unites us than divides us,"" Hillary Clinton says of Bernie Sanders in her speech in Pennsylvania"
2514,8304333127_10153361822073128,Play this election game to see which parties could work together after the votes are in.
234,8304333127_10154900989223128,"The states to watch on Election Day: Florida, North Carolina, Pennsylvania, New Hampshire and Michigan."
927,8304333127_10154598344733128,"Former President Bill Clinton and his daughter, Chelsea, plan to stop raising money for the Clinton Foundation and turn over operations to independent parties if Hillary Clinton is elected president."
1883,8304333127_10154091913308128,"Ted Cruz is locked in a four-way delegate battle with Donald J. Trump, Marco Rubio and John Kasich."
1292,8304333127_10154426815408128,Turkish President Recep Tayyip Erdogan called for Donald J. Trump's name to be removed from the towers due to what Mr. Erdogan termed the presumptive Republican presidential nominee’s Islamophobia.
1730,8304333127_10154215109448128,"The 10-Point: Gerard Baker on today's top news, including Boeing talks on airliner sales to Iran, Donald J. Trump and Hillary Clinton on the campaign trail in New York, and more."
1590,8304333127_10154278219913128,Four questions for Hillary Clinton as she rolls into the next phase of her presidential bid.
2097,8304333127_10153997676438128,"The 10-Point: Gerard Baker on Donald Trump, Xerox, Japanese interest rates, Syria and more"
466,8304333127_10154802545903128,Why aren't more people watching football this year? It could be the election. It could be the cord-cutters. Or it could just be the football.
1443,8304333127_10154337020513128,"Lewis Lukens, a State Department official who worked on logistical issues for Hillary Clinton during her time in office, proposed giving the former Secretary of State a computer in her office to allow her to check her non-State Department email account."
1562,8304333127_10154290022378128,Donald J. Trump also said he supports holding down the value of the dollar in order to help American manufacturing and the economy.
552,8304333127_10154774327243128,House Speaker Paul Ryan told GOP lawmakers that he won’t defend or campaign with Donald J. Trump in the wake of his 2005 lewd video.
1388,8304333127_10154368494548128,"Gov. Brown offered a tepid endorsement of Hillary Clinton in an open letter to Democrats and independent voters, saying it was the only way to “stop the dangerous candidacy of Donald J. Trump.”"
967,8304333127_10154570508138128,"Hillary Clinton has been strategically flooding swing state airwaves all summer, while Donald Trump has yet to spend a dollar on television ads. WSJ's Shelby Holliday explains how the advertising battlegrounds are shifting."
301,8304333127_10154877782788128,"President Obama criticized the FBI’s handling of the Hillary Clinton email probe, saying the government doesn't normally use “innuendo” or “incomplete information” when conducting investigations."
2280,8304333127_10153791185123128,"Most GOP presidential contenders fume about Russia’s new military incursion in Syria and talk of confronting Mr. Putin. Donald Trump, however, is staking out a quite different position, writes Gerald F. Seib."
1154,8304333127_10154501651053128,"What questions do you have about the Democratic race? Congressman Xavier Becerra, chairman of the House Democratic Caucus and a Clinton campaign surrogate, is answering your questions now."
949,8304333127_10154585257683128,"Vice President Joe Biden will make his 2016 campaign-trail debut Monday in blue-collar Scranton, Pa., where he is expected to draw on his boyhood in northeastern Pennsylvania during a joint appearance with Hillary Clinton."
1033,8304333127_10154541640813128,"Sen. John McCain of Arizona, a former prisoner of war, delivered the sharpest criticism by any Republican senator of Donald Trump over his public tangle with the parents of a Muslim U.S. Army captain killed in Iraq. WSJ's Janet Hook explains on Lunch Break with Tanya Rivero."
149,8304333127_10154911505283128,What questions do you have about the results of the 2016 election and the transition to president-elect Donald Trump? Post your questions in the comments below.
185,8304333127_10154908848058128,Donald J. Trump has proved markets wrong.
347,8304333127_10154854691128128,"While the Trump and Clinton campaigns are making aggressive plays in North Carolina, their approaches on the ground differ."
1269,8304333127_10154446857913128,Hillary Clinton's allies dismissed the possibility of further legal fallout for the presumptive Democratic presidential nominee from an FBI probe into her use of a private email server to conduct official business.
757,8304333127_10154693680103128,"House Speaker Paul Ryan said Donald Trump should release his tax returns, but deferred to the GOP presidential candidate on when to do so."
580,8304333127_10154770604223128,"What Trump and Clinton need to do at tonight's #debate, one of the largest stages of the entire campaign ."
2481,8304333127_10153456519503128,"""Dark money distorting democracy, the possibility of corruption—these evils cannot be easily dismissed. To make the case in favor of the First Amendment, one must return to first principles.""James Taranto discusses the connection between the First Amendment, Hillary Clinton, and The New York Times for WSJ Opinion."
1803,8304333127_10154163656223128,"Democratic presidential candidate Bernie Sanders spoke to supporters in Wisconsin Saturday night as he cut into front-runner Hillary Clinton’s delegate lead with wins in the Hawaii, Washington and Alaska caucuses."
139,8304333127_10154912484748128,"As Americans returned to work Wednesday, bosses said they were giving them time to react to Republican Donald Trump’s startling election victory, while trying to get attention back on business after a tense campaign season."
1455,8304333127_10154334102093128,The report contradicts Hillary Clinton’s longstanding argument that her exclusive use of a private email server while running the State Department was allowed as a matter of policy.
2208,8304333127_10153875321353128,"The internal strife, which Mr. Trump has both helped to create and stoked in his quest for the GOP presidential nomination, has rekindled an old threat: That he’ll quit the race and run as an independent candidate in November, significantly upping the chances of a Democrat winning."
1944,8304333127_10154074102443128,"Now the anti-Trump forces have basically four choices, Washington Bureau Chief Gerald F. Seib writes."
270,8304333127_10154890268673128,"In the U.S. election, some investors see Brexit."
351,8304333127_10154851964683128,"The new emails in the Hillary Clinton server probe were found during the FBI's investigation of Anthony Weiner, who is being investigated for allegedly sending sexually explicit messages to a minor."
1446,8304333127_10154336457953128,"""I have said many times it was a mistake and if I could go back, I would do it differently,” said Hillary Clinton"
1195,8304333127_10154481485973128,"Nearly 150 technology executives have published an open letter to Donald J. Trump, laying out why they don't support the presumptive Republican nominee and calling him a ""disaster for innovation."""
1659,8304333127_10154250288378128,"The Kremlin is creating a new internal security force that answers directly to Russian President Vladimir Putin, ahead of parliamentary elections."
484,8304333127_10154795774833128,"In what appear to be transcripts of her comments at paid talks in 2013, Hillary Clinton spoke about the importance of free trade and sounded a skeptical note about financial regulation."
