,statis_id,content
1716,8304333127_10154222756023128,Donald J. Trump’s campaign manager Corey Lewandowski will not be charged with battery for allegedly grabbing the arm of reporter Michelle Fields while she was trying to ask Mr. Trump a question at an event in Florida in March.
2368,8304333127_10153674889653128,Donald J. Trump signed a pledge saying he won't seek a third-party bid if he fails to win the Republican nomination in 2016.
2179,8304333127_10153900496708128,"Hillary Clinton went missing during the Democratic debate, and it didn't go unnoticed."
928,8304333127_10154596589323128,"The 10-Point: Gerard Baker on the Iran cash transfer, Trump's campaign shakeup and more top stories."
176,8304333127_10154909572623128,"“The market wanted the certainty and clarity of a Clinton win—it may not agree with all of her policy proposals, but it was comfortable with gridlock.”"
1696,8304333127_10154230954793128,"Donald Trump, Hillary Clinton, Bernie Sanders and John Kasich would each be the first to represent their colleges as president."
842,8304333127_10154649826073128,"Bill and Hillary Clinton's personal foundation gave $2.6 million to charities in 2015, with the largest gift of $1.5 million going to their own global nonprofit group."
1799,8304333127_10154169437493128,"As Hillary Clinton and Donald Trump aim to clinch their parties’ nominations, the former secretary of state is poised to start the general-election campaign with a far more sophisticated operation than the real-estate billionaire."
440,8304333127_10154812342183128,Join us for live analysis as Hillary Clinton and Donald J. Trump face off in their third and final debate:
1524,8304333127_10154299113448128,The Chinese Communist Party has a “Trump problem.”
1495,8304333127_10154312644623128,"The 10-Point: Gerard Baker on distortions in the U.S. bond market, Clinton vs. Sanders, the gender pay gap and more"
1482,8304333127_10154324715673128,"A bid by an Austrian right-wing party to capture the country’s presidency for the first time was hanging in the balance, with exit polls showing the result of a bellwether election for populist parties across Europe was too close to call."
1003,8304333127_10154551843223128,Republican vice presidential nominee Mike Pence said he may have a “born to be mild” style but he is in lockstep philosophically with GOP presidential nominee Donald Trump.
263,8304333127_10154891296548128,"""We want to throw a bash that’s as asinine as this election."""
2069,8304333127_10154013579373128,"The 10-Point: Gerard Baker on the Clinton-Sanders debate, Viacom’s chairman, Syrian refugees and more"
2527,8304333127_10153333354723128,"In the upcoming general elections in the U.K., people with Indian heritage will play a key role in helping to decide the outcome. Here's a look at the numbers."
1520,8304333127_10154305817068128,New shows from NBC include a revamped version of the Donald J. Trump reality show The Apprentice starring movie star and former California Gov. Arnold Schwarzenegger.
400,8304333127_10154828386183128,"Every so often, U.S. lawmakers propose making Election Day a federal holiday in hopes of nudging more voters to the polls. This year, a handful of employers are taking matters into their own hands."
21,8304333127_10154941820048128,"Just days after Donald J. Trump secured the White House, the real-estate mogul scored a legal victory in a decadelong trademark dispute over the right to use his name in China for certain services."
1450,8304333127_10154335453973128,"Hillary Clinton won't debate Bernie Sanders anymore, but Donald J. Trump appears willing, on Wednesday saying he would accept the Vermont senator's challenge."
2282,8304333127_10153788337778128,Tanzanians are going to the polls in a tight election.
2405,8304333127_10153619884593128,"Donald J. Trump never skips a chance to remind audiences of his wealth, but he is proving reluctant to spend his own money on campaign essentials typical of a major presidential candidate."
2139,8304333127_10153963398173128,"Donald Trump has opened a double-digit lead over his next-closest Republican rival, Ted Cruz, less than three weeks before the first votes of the 2016 presidential race are cast."
730,8304333127_10154709127758128,Ameritrade founder Joe Ricketts has decided to endorse Donald Trump and plans to donate at least $1 million to his campaign—after pouring nearly $6 million into an anti-Trump effort.
1825,8304333127_10154134917293128,"Mr. Trump’s Republican challengers, Texas Sen. Ted Cruz and Ohio Gov. John Kasich, and Democratic front-runner Hillary Clinton are also scheduled to address Aipac on Monday. Mrs. Clinton’s rival, Bernie Sanders, the only Jewish candidate, declined an invitation to speak and is campaigning on the West Coast."
1277,8304333127_10154437359673128,"After flipping between the two parties in the last two presidential elections, North Carolina is emerging as a key battleground and a highly trafficked destination for both parties’ presumptive nominees."
1420,8304333127_10154351813763128,Unions spend heavily to support Democrats in elections and wield great influence over whether their members support those candidates. But labor leaders fear many of their members could be drawn to Donald J. Trump.
2074,8304333127_10154012767698128,"An ""artful smear.""Watch Bernie Sanders and Hillary Clinton debate the issue of political donations from Wall Street and large corporations."
2006,8304333127_10154045924383128,"The 10-Point: Gerard Baker on Donald Trump and the Pope, disappearing IPOs, Apple and Justice and more"
87,8304333127_10154918120218128,"The Dow industrials climbed to a record and bond yields rose around the world for a second day, as investors applauded the prospects of expansive fiscal spending under a Trump administration."
755,8304333127_10154694286133128,Hillary Clinton returned to the campaign trail after resting three days due to pneumonia—and sought to refine her appeal to voters after losing ground to Donald J. Trump in the polls.
637,8304333127_10154750649583128,"McDonald’s is looking to cut a deal to turn its 2,200-store empire in China—65% of which it owns and operates—into a cash machine."
1650,8304333127_10154254258418128,We are back! Tell us your questions about the 2016 election.
913,8304333127_10154609943893128,"The 10-Point: Gerard Baker on Obama’s troubled trade deal, Trump’s fundraising and more top stories."
849,8304333127_10154646824733128,"In the 2016 race, it’s sitting vice president Joe Biden – perhaps more so than Democratic vice presidential nominee Tim Kaine – who may be emerging as Donald J. Trump 's chief antagonist."
2426,8304333127_10153593267418128,Democrat front-runner Hillary Clinton is set to air the first TV commercials of her presidential campaign—two spots that highlight her biography and motivation for running at a time when she is under fire and losing ground in some polls.
1355,8304333127_10154375039968128,At the center of a criminal probe involving Hillary Clinton’s handling of classified information is a series of emails between American diplomats in Islamabad and their superiors in Washington about whether to challenge specific drone strikes in Pakistan.
2205,8304333127_10153878915368128,Presidential candidate Donald Trump’s call to ban Muslim immigrants is straining his already shaky relationship with the Republican establishment in his home state of New York.
2254,8304333127_10153819299008128,Foreign observers endorse Myanmar's election but raise concerns over the military’s institutional levers of control.
1116,8304333127_10154510439108128,"Compare Clinton and Trump in the number of Twitter followers, tweets by hour and top 10 retweets."
39,8304333127_10154936804303128,"“Only Trump knows what he wants Bannon’s job to be,” said John Sununu, chief of staff to President George H.W. Bush."
568,8304333127_10154772277793128,"Live coverage:  Sunday night shortly before the presidential debate was to start, Donald Trump held a brief surprise press conference on Facebook Live that included women who have accused Bill Clinton of sexual misconduct in the past."
1959,8304333127_10154068550933128,Hillary Clinton's South Carolina primary win marked a turnaround from a divisive 2008 presidential race that left her relationship with many in the black community in tatters.
2050,8304333127_10154024468818128,John Kasich comes in second behind Donald J. Trump in the New Hampshire primary.
547,8304333127_10154775179008128,"About 63.6 million people tuned in to watch Hillary Clinton and Donald Trump battle on Sunday, according to preliminary Nielsen data provided by TV networks. That figure was less than the 84 million who watched the first debate."
500,8304333127_10154786654533128,"The Obama administration is planning to use TV ads and direct mail to boost participation in the Affordable Care Act’s exchanges in the coming open-enrollment period, but its timing will mean fighting for attention amid the noise of the election."
770,8304333127_10154689987473128,"Ivanka Trump, daughter of Donald Trump, writes in WSJ Opinion that her father wants to empower working and stay-at-home parents and give families freedom of choice in child care.The Trump plan will help working mothers, writes Ivanka Trump in WSJ Opinion."
1674,8304333127_10154241139803128,"Democratic front-runner Hillary Clinton maintains a sizable lead over rival Bernie Sanders in convention delegates, but to clinch the nomination she will likely need the help of superdelegates."
821,8304333127_10154664287198128,Donald J. Trump announced support from 88 retired military generals and admirals as he plans a two-day campaign swing aimed at highlighting his aim to rebuild the nation’s armed forces.
337,8304333127_10154861594108128,Close to 40 states are working with the Department of Homeland Security to prevent any digital tampering of their election systems.
1505,8304333127_10154310065108128,Some members of the right-leaning grass-roots movement dubbed the tea party have been slow to support Donald J. Trump. WSJ's Gerald F. Seib discusses whether they might become reluctant supporters of the presumptive GOP nominee or push for a third-party candidate.
1014,8304333127_10154548459258128,"Without naming Republican presidential nominee Donald Trump, former President George W. Bush delivered an incisive critique of his policies of “isolationism, nativism and protectionism."""
2068,8304333127_10154013813178128,A New Hampshire tattoo artist is offering to ink Donald Trump’s slogan or his likeness on people’s bodies for free.
572,8304333127_10154771941593128,"Everyone from Sen. John McCain to Condoleezza Rice has dropped their support of Donald Trump over a crude video from 2005. But the candidate is firing back on Twitter, leading to what Trump surrogate Rudy Giuliani calls a battle between ""insiders and outsiders."" Full story: "
1032,8304333127_10154541830928128,A new poll shows Hillary Clinton enjoying a significance bounce after last week's Democratic convention.
2256,8304333127_10153817252138128,"The results of the Bihar state election in India were unexpected in scale if not entirely unforeseen in outcome, giving politicians and pundits much to ponder on."
812,8304333127_10154669328938128,"The 10-Point: Gerard Baker on today's top news, including Donald J. Trump and Hillary Clinton's sparring on the U.S. role on the global stage and more."
1404,8304333127_10154362896713128,A split is emerging inside the Bernie Sanders campaign over whether the senator should stand down after Tuesday’s election contests or take the fight all the way to the July party convention.
2008,8304333127_10154044658273128,"Sen. Bernie Sanders has cut Hillary Clinton’s once-commanding national lead in the Democratic primary race by more than half over the last month, a new Wall Street Journal/NBC News poll finds.Mrs. Clinton holds a solid but diminished lead among her core group of supporters: women."
1048,8304333127_10154532752158128,"The 2016 presidential campaign has dealt a potentially lethal blow to President Obama’s signature Pacific trade agreement, TPP, with the chances of congressional passage now looking slim either after the election or under the next administration."
1372,8304333127_10154370492713128,"The 10-Point: Gerard Baker on Hillary’s victory, Aubrey McClendon’s death, Europe’s low bond yields and more"
996,8304333127_10154555881623128,Where Hillary Clinton  and Donald J. Trump agree: infrastructure needs.
247,8304333127_10154897420163128,Americans may be weary of the grueling 2016 presidential race. But media companies would be thrilled if the Donald Trump and Hillary Clinton show never ended.
88,8304333127_10154918079168128,"On one side of Trump's transition team is the Heritage Foundation, the Washington think tank whose aggressively conservative policies have contributed to the internal split among Republicans. On the other are veterans of the more traditional pro-business wing of the party, who have worked for previous GOP nominees and presidents."
520,8304333127_10154781085958128,The discontent driving Donald Trump’s campaign stems in part from the dashed employment promises of the late 1990s.
964,8304333127_10154571756173128,"Nine of Donald Trump’s 14 economic advisers are known for audacious bets and, sometimes, spectacular flameouts. Five are among the Republican presidential nominee’s biggest donors."
2013,8304333127_10154042299778128,"Support for Donald Trump among Republicans has declined in the past month, leaving him slightly behind Sen. Ted Cruz in the race for GOP presidential nominee, according to a new Wall Street Journal/NBC News poll.The poll also shows that if the primary came down to a head-to-head choice, both Mr. Cruz and Sen. Marco Rubio could beat Mr. Trump by double-digit margins."
470,8304333127_10154800669673128,"“If I am elected President, the Indian and Hindu community will have a true friend in the White House, that I can guarantee you,"" said U.S. Republican presidential candidate Donald J. Trump in his 13-minute speech to Indians in America."
2460,8304333127_10153498812943128,"There are at least 15 emails that Hillary Clinton didn’t hand over from her personal server, the State Department says."
1436,8304333127_10154343243413128,"Marco Rubio conceded that he made campaign blunders, including mocking presumptive Republican presidential nominee Donald J. Trump for the size of his hands — a comment he said he has since apologized for."
1368,8304333127_10154371934123128,"With the Democratic primary behind her, Hillary Clinton said she now plans to put Donald J. Trump’s economic record and agenda at the center of her campaign, calling his ideas “deeply misguided” and “dangerously incoherent.”"
638,8304333127_10154750628023128,"The 10-Point: Gerard Baker on Trump’s tax records, Deutsche Bank and more top stories "
1118,8304333127_10154509638913128,"U.S. Senator Tim Kaine has a foreign policy background, speaks Spanish, and has never lost an election."
424,8304333127_10154814767893128,"Donald Trump is warning supporters that widespread voter fraud could cost him the election. What is the Republican presidential nominee referring to, and is there any evidence to support his point? WSJ's Shelby Holliday reports."
934,8304333127_10154593179128128,"The 10-Point: Gerard Baker on Donald Trump's campaign overhaul, Russian airstrikes on Syria and more top stories."
1721,8304333127_10154221171713128,"Bernie Sanders, trailing Hillary Clinton ahead of Tuesday’s New York primary, has a coalition of Brooklynites behind him. Is their passion enough to stoke an upset?"
982,8304333127_10154565210093128,Donald J. Trump delivered an economic-policy address in Detroit full of facts and figures about the state of the U.S. economy. His speech generally presented accurate numbers but in many cases omitted important context and downplayed recent improvement.
2486,8304333127_10153449997933128,"The AKP’s electoral setback stands to provide a glimmer of hope to Turkey’s long-sidelined opposition after two years marked by crackdowns against dissent, bureaucratic purges and sporadic protests."
1164,8304333127_10154499501453128,"Donald J. Trump’s economic views, on trade, taxes and entitlement spending, throw aside the traditional Republican playbook and raise questions about the party’s long-term identity."
1058,8304333127_10154530429293128,"“Of course, I’m being sarcastic,” Donald J. Trump says."
1451,8304333127_10154335379693128,"Donald J. Trump on Thursday reached the number of delegates needed to clinch the Republican nomination for president, according to an updated AP count."
687,8304333127_10154731216963128,"“When they raise interest rates, you’re going to see some very bad things happen, because they’re not doing their job,” Donald J. Trump said."
2490,8304333127_10153444290488128,Hillary Clinton proposed that Americans be automatically registered to vote when they turn 18.
1043,8304333127_10154538842603128,"Donald Trump took issue with Khizr Khan, who had questioned whether Mr. Trump had read the U.S. Constitution and said Mr. Trump had “sacrificed nothing.” Mr. Trump responded by citing his hard work and business success."
2119,8304333127_10153986282848128,"Sarah Palin made headlines last week when she endorsed presidential candidate Donald J. Trump. Accordingly, Saturday Night Live wasted no time in calling up Palin impersonator Tina Fey for their opening skit."
1327,8304333127_10154405241683128,"Hillary Clinton and Donald J. Trump are not scheduled to attend the largest annual gathering of Hispanic policy makers and officeholders in Washington, D.C. next week."
2339,8304333127_10153719113773128,Greece’s leftwing Syriza party is poised to win elections by more than 7 percentage points over rival conservatives New Democracy.
1765,8304333127_10154195451483128,"In final pleas to Wisconsin Democrats, Hillary Clinton and Sen. Bernie Sanders issued a similar warning: A vote for the other risks defeat in the general-election showdown with Republicans."
1194,8304333127_10154481806593128,Donald J. Trump tells GOP officials that he's picking Indiana Gov. Mike Pence as his vice presidential running mate. WSJ's Shelby Holliday takes a closer look at the life and political career of Gov. Pence.
2026,8304333127_10154036426188128,Donald Trump’s blunt attacks on Jeb Bush and his family during Saturday’s Republican presidential debate reinforced his tough-guy image for some supporters but is backfiring with others and among undecided voters.
1740,8304333127_10154211148028128,"The editorial board of The Boston Globe produced what it calls “a front page in Trump’s America” dated April 9, 2017."
177,8304333127_10154909540933128,"Across financial markets from New York to Hong Kong, traders were left flat-footed as Mr. Trump surged toward claiming the 270 Electoral College votes needed for victory in the U.S. presidential election.Now they’re preparing for far more upheaval in global financial markets, even as some look for bargains."
1679,8304333127_10154238996663128,Donald J. Trump has found a solution that cuts both his grass and his tax bill: Goats.
1036,8304333127_10154541130253128,John McCain enters the Trump-Khan family spat; Doctors find new ways to treat bedsores; Red wine in a bottle.
2196,8304333127_10153887393568128,"“If elected, Mr. Trump, I can state unequivocally, will be the healthiest individual ever elected to the presidency."" — Donald J. Trump's doctor"
2231,8304333127_10153847101358128,The video of the shooting death of 17-year-old Laquan McDonald was released following a news conference by Chicago Mayor Rahm Emanuel and Chicago Police Superintendent Garry McCarthy.
607,8304333127_10154762365853128,"Bono of band U2 delivered a nearly three-minute anthem on Wednesday night to slam the Republican nominee for his tough immigration position. Bono is good friends with Marc Benioff, CEO of Salesforce.com Inc., the cloud-software giant taking over San Francisco this week with its conference called Dreamforce attended by 170,000 customers and partners.The unusual performance opens with the U2 band in front of a wall-sized video screen of Trump saying “I’m really rich.”"
1261,8304333127_10154450343688128,Hillary Clinton’s low favorability rating means down-ballot Democratic candidates could be taking a risk by tying themselves to the party’s presumptive nominee.
806,8304333127_10154671043758128,"House Speaker Paul Ryan and other Republicans distanced themselves from Donald J. Trump on Russia, criticizing Russian President Vladimir Putin one day after Mr. Trump said he welcomed praise from the Russian leader."
2520,8304333127_10153357742553128,"The share of people with a negative view of Hillary Clinton jumped to 42% from 36% in last month’s survey. But she remains highly regarded among Democrats, with 76% saying they viewed her favorably."
318,8304333127_10154870968273128,The polarized 2016 presidential campaign has some hosts devising strategies to keep their election watch parties civil.
2488,8304333127_10153445075638128,"Turkey's pugilistic president, Recep Tayyip Erdogan, isn't sounding confident about the tight election approaching. “I don’t see the excitement of previous elections. The old livelihood, the old hustle and bustle that I’m used to is unfortunately not there.”"
1986,8304333127_10154053831703128,Daniel J. Arbess for WSJ Opinion: Why are young people voting against their own interests by supporting Sanders and Trump?
2288,8304333127_10153779136363128,Hillary Clinton has widened her lead in the Democratic primary race after a strong performance in the TV debate. Here are the stats on Democratic and Republican candidates.
781,8304333127_10154687094858128,"The Supreme Court refused to reinstate Ohio’s “golden week,” a period five days before Election Day when citizens could register to vote and cast ballots in a single visit to the Board of Elections."
1006,8304333127_10154551240473128,"""Trump campaign manager Paul Manafort will quit or be fired."" Six pros weigh in with their take on things to come—and predictions, some perhaps more likely than others."
2034,8304333127_10154032222123128,"Six candidates take the stage tonight in South Carolina: Donald J. Trump, Ted Cruz, John Kasich, Jeb Bush, Marco Rubio and Dr. Ben Carson. Here's what they'll aim to accomplish."
2319,8304333127_10153749002973128,Gun control marks a rare issue in which frontrunner Hillary Clinton’s views are more liberal than those of Sen. Bernie Sanders.
179,8304333127_10154909184508128,This is the first time Maine has split its electoral votes since it began its proportional system in 1972.
148,8304333127_10154911716058128,"Democratic Presidential Nominee Hillary Clinton spoke directly to women and girls in her concession speech, urging them to pursue their dreams. Full story: "
1748,8304333127_10154205761408128,"As the race for delegates tightens, Donald J. Trump adds some political expertise to his antiestablishment campaign."
498,8304333127_10154787299908128,The clearest dividing line in this year’s presidential election now falls along educational lines: Whites without a college degree have consolidated behind Donald J. Trump and those with a four-year degree are tending to back Hillary Clinton.
1631,8304333127_10154260891283128,"An unknown white powder was found in an envelope addressed to Republican presidential candidate Donald Trump, drawing hazmat units to his campaign offices at the Trump Tower in Manhattan."
662,8304333127_10154738441383128,"Donald Trump’s campaign has advised his surrogates how to bring up Bill Clinton's past infidelities in media interviews, even as they publicly praise the candidate for showing “restraint,” “courage” and “self-control” by not raising the issue in Monday night's debate."
401,8304333127_10154828184968128,"Two dozen billionaires have spent $88 million on the 2016 presidential campaign, bankrolling an election in which both major-party nominees have railed against the influence of money in politics."
1992,8304333127_10154049774648128,"Sen. Bernie Sanders’s path ahead in the Democratic presidential primary was already challenging, and it was made more so by his defeat Saturday in the Nevada caucuses to Hillary Clinton."
2497,8304333127_10153433564933128,Sepp Blatter struck a defiant tone after a tumultuous week at FIFA that ended in his re-election as president.
886,8304333127_10154624424023128,"The 10-Point: Gerard Baker on Trump's immigration plan, the Fed's annual Jackson Hole symposium and more "
1617,8304333127_10154271978523128,Pakistan dismisses Donald J. Trump's claim that Islamabad could be pressured into releasing an imprisoned doctor who U.S. officials say helped them in the hunt for Osama bin Laden.
907,8304333127_10154613370278128,"The 10-Point: Gerard Baker on today's top news, including the State Department's review of new Clinton emails, the alcohol industry's offensive and more."
765,8304333127_10154690868453128,This year’s presidential election between Hillary Clinton and Donald Trump could show shifting political allegiances among the states. A look at past presidential elections and current polling shows how big a swing these changes would be.
1842,8304333127_10154120400233128,Donald J. Trump has demonstrated the breadth of his sway with working-class voters.
